customer_id,name,email,phone,address,birthdate
fshurmer31766,Fredi Shurmer,fredi.shurmer@hotmail.com,(612) 923-0954,"14655 Winifred Way, Saint Paul, Minnesota, United States, 55108",2024-02-10T11:56:21+00:00
kmeddings16044,Kimmie Meddings,kimmie.meddings@hotmail.com,(818) 074-7854,"7806 Dadeo Place, Northridge, California, United States, 91328",2024-03-10T08:04:36+00:00
tschoffler27911,Theodoric Schoffler,theodoric.schoffler@yahoo.fr,(703) 988-1670,"1432 Mulligan Run, Alexandria, Virginia, United States, 22301",2023-12-10T03:22:46+00:00
swarboy42339,Stavro Warboy,stavro.warboy@sfr.fr,(941) 560-9091,"13868 Ridge Spring Drive, Bonita Springs, Florida, United States, 34135",2024-05-31T05:40:55+00:00
hmelvin21667,Hewe Melvin,hewe.melvin@gmail.com,(573) 667-6097,"3530 Cammarano Place, Columbia, Missouri, United States, 65211",2024-09-25T04:31:39+00:00
rwhinney43860,Rowland Whinney,rowland.whinney@yahoo.com,(323) 759-5674,"7901 Alzarine Terrace, Glendale, California, United States, 91205",2024-09-10T22:17:24+00:00
jparren20983,Judah Parren,judah.parren@hotmail.com,(310) 712-7715,"1076 Arnett Avenue, Inglewood, California, United States, 90398",2023-11-23T12:46:01+00:00
bde broke33913,Bryce de Broke,bryce.de broke@hotmail.com,(347) 448-7153,"11782 Poole Terrace, Flushing, New York, United States, 11388",2023-12-01T02:58:18+00:00
scottill60213,Shane Cottill,shane.cottill@hotmail.com,(916) 096-5097,"1122 Hiles Place, Sacramento, California, United States, 94257",2023-10-25T17:17:37+00:00
gmuzzlewhite20013,Gabi Muzzlewhite,gabi.muzzlewhite@gmail.com,(719) 739-4469,"9643 Casey Court, Colorado Springs, Colorado, United States, 80920",2024-02-14T07:57:51+00:00
rcaunter43790,Randall Caunter,randall.caunter@hotmail.com,(304) 859-7821,"14591 Driftwood Place, Charleston, West Virginia, United States, 25305",2024-04-05T00:50:46+00:00
cknapton57977,Collette Knapton,collette.knapton@yahoo.com,(937) 389-9034,"1693 Crestwood Lane, Hamilton, Ohio, United States, 45020",2024-09-24T07:00:46+00:00
mgaucher62157,Muffin Gaucher,muffin.gaucher@yahoo.com,(401) 658-6398,"2506 Hollywood Terrace, Providence, Rhode Island, United States, 02912",2024-03-23T03:24:51+00:00
csabbins17608,Claire Sabbins,claire.sabbins@msn.com,(213) 657-6400,"14848 Willington Way, Van Nuys, California, United States, 91411",2023-10-20T09:19:24+00:00
agrainge51171,Aridatha Grainge,aridatha.grainge@libero.it,(913) 499-1895,"10609 Reevesville Lane, Kansas City, Kansas, United States, 66160",2024-06-28T17:50:12+00:00
lollivier3129,Latrena Ollivier,latrena.ollivier@yahoo.com,(281) 042-9245,"11579 Hurtt Street, Spring, Texas, United States, 77386",2024-01-22T10:31:42+00:00
bwarratt48509,Bearnard Warratt,bearnard.warratt@hotmail.com,(704) 047-9131,"2384 Buster Place, Charlotte, North Carolina, United States, 28230",2024-02-20T05:07:19+00:00
rfuke18815,Ramonda Fuke,ramonda.fuke@hotmail.com,(209) 129-7620,"6199 Bay Meadows Circle, Stockton, California, United States, 95219",2024-08-29T01:27:40+00:00
vsivyour13551,Vince Sivyour,vince.sivyour@gmail.com,(972) 053-9674,"13637 La Estrellita Way, Dallas, Texas, United States, 75241",2024-10-02T11:53:03+00:00
ckoch62488,Carla Koch,carla.koch@orange.fr,(904) 707-8647,"8411 Kuzmany Court, Saint Augustine, Florida, United States, 32092",2024-07-22T05:08:00+00:00
dhearmon21979,Denyse Hearmon,denyse.hearmon@yahoo.com,(772) 112-1799,"2331 Coronaca Court, Vero Beach, Florida, United States, 32964",2024-08-03T02:23:51+00:00
dcrecy6856,Dorian Crecy,dorian.crecy@hotmail.com,(775) 327-1088,"12479 Cottageville Lane, Carson City, Nevada, United States, 89714",2024-01-02T10:15:43+00:00
cadamo37006,Carlin Adamo,carlin.adamo@gmail.com,(585) 612-7044,"4462 Ortega Way, Rochester, New York, United States, 14614",2024-07-08T07:24:31+00:00
lgiraudo11416,Lucita Giraudo,lucita.giraudo@gmail.com,(205) 704-6857,"4686 Gillian Street, Tuscaloosa, Alabama, United States, 35487",2024-01-14T00:20:16+00:00
lo'suaird5750,Linn O'Suaird,linn.o'suaird@gmx.de,(216) 131-2082,"9147 Baton Place, Cleveland, Ohio, United States, 44111",2024-09-24T06:24:06+00:00
jlyenyng37125,Jaquelyn Lyenyng,jaquelyn.lyenyng@gmail.com,(919) 661-9075,"10027 Hilda Way, Durham, North Carolina, United States, 27717",2023-12-18T04:32:43+00:00
abeebis4394,Ame Beebis,ame.beebis@yahoo.fr,(412) 825-4609,"369 Harmony Circle, Pittsburgh, Pennsylvania, United States, 15225",2024-07-14T20:21:21+00:00
ceschalette21483,Cynde Eschalette,cynde.eschalette@hotmail.com,(602) 625-7992,"10392 Hoyt Road, Phoenix, Arizona, United States, 85099",2024-08-25T04:00:41+00:00
ccargon34532,Cesya Cargon,cesya.cargon@yahoo.com,(786) 466-2613,"8513 Sugarberry Lane, Miami, Florida, United States, 33180",2024-03-01T15:05:22+00:00
lpersicke44563,Lia Persicke,lia.persicke@gmail.com,(214) 635-9473,"11408 Harrison Road, Dallas, Texas, United States, 75205",2024-09-01T01:53:57+00:00
rcolleymore9838,Rhody Colleymore,rhody.colleymore@hotmail.com,(419) 222-8166,"654 Orr Terrace, Toledo, Ohio, United States, 43699",2024-04-16T19:28:26+00:00
atewkesberry57402,Andie Tewkesberry,andie.tewkesberry@yahoo.com,(971) 602-2212,"4091 Kaden Court, Portland, Oregon, United States, 97240",2024-09-22T11:11:21+00:00
rshrieve48907,Robbyn Shrieve,robbyn.shrieve@gmail.com,(504) 283-9955,"12427 Joette Place, New Orleans, Louisiana, United States, 70187",2024-01-08T01:46:44+00:00
rgosnay60704,Rodrique Gosnay,rodrique.gosnay@gmail.com,(405) 615-9010,"11574 Ava Street, Edmond, Oklahoma, United States, 73034",2023-10-22T06:08:44+00:00
amccloy8560,Abbe McCloy,abbe.mccloy@hotmail.com,(504) 976-4782,"10691 Panchos Way, New Orleans, Louisiana, United States, 70183",2024-05-05T12:30:52+00:00
rzimek28661,Roxanna Zimek,roxanna.zimek@yahoo.com,(785) 255-4895,"5058 Daniel Hearns Way, Topeka, Kansas, United States, 66699",2023-10-20T11:04:55+00:00
lkyles53161,Leonhard Kyles,leonhard.kyles@yahoo.com,(281) 371-2366,"11026 Madrigal Lane, Houston, Texas, United States, 77045",2023-12-14T13:23:33+00:00
bhamfleet64889,Blayne Hamfleet,blayne.hamfleet@hotmail.com,(404) 844-4436,"6816 Bellerose Trail, Atlanta, Georgia, United States, 31136",2024-01-07T05:41:58+00:00
csarsons19694,Coralie Sarsons,coralie.sarsons@bigpond.com,(612) 164-3504,"10731 Sennett Circle, Minneapolis, Minnesota, United States, 55407",2023-12-31T04:27:33+00:00
zdur46714,Zechariah Dur,zechariah.dur@gmail.com,(510) 054-9066,"6729 Bermuda Place, Oakland, California, United States, 94611",2024-03-17T17:32:38+00:00
gmathou12818,Granny Mathou,granny.mathou@rediffmail.com,(720) 451-2239,"6320 Bladewood Court, Denver, Colorado, United States, 80204",2024-07-25T00:38:30+00:00
sshrieve61812,Sampson Shrieve,sampson.shrieve@gmail.com,(253) 473-6349,"13046 Dearborn Place, Tacoma, Washington, United States, 98481",2024-03-14T21:01:44+00:00
ttattersdill32508,Todd Tattersdill,todd.tattersdill@gmail.com,(319) 164-8964,"13075 Navarro Court, Waterloo, Iowa, United States, 50706",2024-02-04T14:32:27+00:00
fmidgely63515,Faun Midgely,faun.midgely@gmail.com,(504) 160-0649,"4932 Ridley Terrace, Metairie, Louisiana, United States, 70033",2023-11-11T20:38:02+00:00
aingleby10743,Allister Ingleby,allister.ingleby@hotmail.com,(484) 328-3144,"7647 Tara Terrace, Bethlehem, Pennsylvania, United States, 18018",2024-09-23T02:10:49+00:00
gvannozzii51753,Ginevra Vannozzii,ginevra.vannozzii@libero.it,(786) 774-0950,"1443 Sydney Court, Miami, Florida, United States, 33190",2024-04-18T02:01:50+00:00
tjackett34181,Tanya Jackett,tanya.jackett@hotmail.com,(972) 457-3585,"2584 Burnettown Place, Dallas, Texas, United States, 75251",2024-03-13T22:03:33+00:00
chaxbie33485,Chrotoem Haxbie,chrotoem.haxbie@gmail.com,(281) 349-8952,"14647 Carnegie Court, Houston, Texas, United States, 77065",2024-06-23T14:15:17+00:00
jjohnsee59696,Jerald Johnsee,jerald.johnsee@yahoo.com,(440) 213-8645,"5407 Pedro Court, Cleveland, Ohio, United States, 44177",2024-07-10T05:59:02+00:00
jspatari48826,Janey Spatari,janey.spatari@hotmail.com,(216) 856-3451,"6705 Hardeeville Court, Cleveland, Ohio, United States, 44105",2024-07-16T13:15:32+00:00
chugnet60863,Chevalier Hugnet,chevalier.hugnet@hotmail.com,(757) 663-9903,"11099 Leslie Lane, Virginia Beach, Virginia, United States, 23454",2024-05-07T01:44:00+00:00
kcossom41177,Karia Cossom,karia.cossom@yahoo.com,(914) 591-9189,"4110 Nomad Terrace, White Plains, New York, United States, 10606",2024-09-25T01:40:39+00:00
amerton57736,Amitie Merton,amitie.merton@aol.com,(419) 305-4225,"12499 Dandrea Place, Toledo, Ohio, United States, 43615",2024-05-23T00:13:17+00:00
gshallo25938,Ginnie Shallo,ginnie.shallo@gmail.com,(413) 043-7703,"13105 Luraville Road, Springfield, Massachusetts, United States, 01105",2024-03-11T14:09:52+00:00
ycrook59858,Yule Crook,yule.crook@home.nl,(864) 446-1293,"10423 Batesburg Way, Spartanburg, South Carolina, United States, 29305",2024-07-11T00:22:32+00:00
rlymer26284,Raleigh Lymer,raleigh.lymer@yahoo.com.br,(817) 654-1713,"10384 Jasper Way, Fort Worth, Texas, United States, 76115",2024-08-25T21:00:48+00:00
ewychard48150,Esta Wychard,esta.wychard@yahoo.co.uk,(202) 738-8587,"14355 Zapata Place, Washington, District of Columbia, United States, 56944",2024-08-24T08:57:04+00:00
aiggulden22471,Aleta Iggulden,aleta.iggulden@gmail.com,(314) 497-9163,"10164 Pompano Lane, Saint Louis, Missouri, United States, 63104",2024-03-25T01:50:34+00:00
jjay40863,Jack Jay,jack.jay@live.fr,(954) 459-8098,"10658 Knotty Pine Terrace, Fort Lauderdale, Florida, United States, 33315",2023-10-09T10:03:35+00:00
sstark40878,Serene Stark,serene.stark@gmail.com,(210) 651-5784,"7022 Stacey Carter Avenue, San Antonio, Texas, United States, 78245",2024-01-21T02:03:43+00:00
