order_id,customer_id,order_date,total_amount,shipping_address
1,lheadington53377,2024-03-22T11:16:23+00:00,738.45,"7434 Keeneland Place, Flint, Michigan, United States, 48555"
2,mwillford10697,2024-06-16T03:40:56+00:00,905.15,"14424 Doral Circle, Olympia, Washington, United States, 98506"
3,dmattersey58120,2023-10-16T05:35:36+00:00,446.86,"13065 Danbury Street, Houston, Texas, United States, 77040"
4,mmacauley50148,2024-02-19T12:43:24+00:00,919.02,"5531 Castlehill Drive, Chicago, Illinois, United States, 60609"
5,fpiner36812,2023-12-28T17:30:26+00:00,371.32,"780 Puerto Bello Drive, Alhambra, California, United States, 91841"
6,wivain47239,2023-12-20T19:51:38+00:00,695.48,"14196 Timberwood Terrace, Richmond, Virginia, United States, 23220"
7,pmaccaughey37694,2024-03-18T03:16:10+00:00,486.46,"4605 Hartford Lane, Tampa, Florida, United States, 33615"
8,uparsisson38859,2024-08-19T12:44:47+00:00,993.21,"4012 Annadale Terrace, Miami, Florida, United States, 33124"
9,lheadington53377,2024-08-20T09:49:55+00:00,714.63,"7749 Ratcliff Way, Monticello, Minnesota, United States, 55585"
10,callawy30812,2024-02-08T10:42:40+00:00,257.67,"4343 Miranda Way, Panama City, Florida, United States, 32412"
11,cobal25840,2023-12-04T04:13:04+00:00,443.47,"14968 Downers Grove, Huntington, West Virginia, United States, 25775"
12,mridge40007,2024-06-26T05:19:28+00:00,609.99,"8402 Mitchella Lane, Charlotte, North Carolina, United States, 28225"
13,ao'dowd42883,2023-11-11T23:37:46+00:00,565.06,"3571 Amelia Avenue, Brooksville, Florida, United States, 34605"
14,jtirrey22943,2023-11-26T22:10:12+00:00,835.66,"10281 Harley Circle, Cincinnati, Ohio, United States, 45213"
15,kcozins762,2024-08-16T07:32:41+00:00,629.11,"8870 Schulz Way, Manchester, New Hampshire, United States, 03105"
16,mhuison19259,2024-07-16T05:35:06+00:00,325.17,"12994 Apache Court, Garland, Texas, United States, 75049"
17,wivain47239,2024-09-26T17:07:25+00:00,652.44,"14501 Coffman Loop, Seattle, Washington, United States, 98148"
18,ckierans37648,2024-03-10T14:03:44+00:00,672.00,"11691 Morley Avenue, Florence, South Carolina, United States, 29505"
19,lheadington53377,2024-02-05T03:20:15+00:00,368.56,"3418 Hopewell Street, Fort Worth, Texas, United States, 76162"
20,rboken56967,2024-04-03T00:33:08+00:00,432.75,"12947 Batterbee Drive, Denver, Colorado, United States, 80249"
21,rboken56967,2024-08-24T17:38:37+00:00,581.14,"2628 Goliath Place, Rochester, New York, United States, 14619"
22,hschirak15647,2024-02-20T19:51:20+00:00,328.86,"10034 Leeds Place, Phoenix, Arizona, United States, 85083"
23,sarnald40787,2023-11-29T21:43:51+00:00,353.76,"642 Cristo Road, Naples, Florida, United States, 34108"
24,iwent63202,2024-08-01T05:51:38+00:00,540.67,"4184 Valencia Place, Erie, Pennsylvania, United States, 16550"
25,fambrosini35771,2023-11-08T18:19:58+00:00,222.33,"11136 Isabelle Place, Danbury, Connecticut, United States, 06816"
26,estook35965,2024-06-23T07:30:14+00:00,150.28,"2792 Foxgrove Avenue, Bellevue, Washington, United States, 98008"
27,mrobinson46891,2024-04-17T09:26:27+00:00,271.62,"14395 Beard Road, Muskegon, Michigan, United States, 49444"
28,ggarbutt59395,2023-10-20T10:28:41+00:00,842.86,"7546 Southern Oak Street, Charlotte, North Carolina, United States, 28278"
29,sritmeyer27352,2024-08-19T14:27:34+00:00,175.18,"8464 Atwell Avenue, Lubbock, Texas, United States, 79491"
30,mastles46857,2024-02-04T10:33:05+00:00,687.69,"13407 Parksville Path, Chicago, Illinois, United States, 60674"
31,hkinnach9563,2024-06-05T10:59:12+00:00,670.59,"5628 Othello Court, Reston, Virginia, United States, 20195"
32,mwillford10697,2024-08-09T05:34:11+00:00,998.95,"14120 Brinkley Lane, Las Vegas, Nevada, United States, 89125"
33,nsemeniuk8533,2023-10-16T02:14:35+00:00,665.60,"9197 Milow Place, Indianapolis, Indiana, United States, 46247"
34,lupstell101,2024-03-06T09:36:04+00:00,235.01,"6073 White Ibis Run, Santa Barbara, California, United States, 93111"
35,ggelsthorpe17051,2024-04-10T06:59:39+00:00,692.22,"2246 Lauren Lane, Sacramento, California, United States, 95818"
36,kperkins4803,2024-09-16T13:13:01+00:00,525.15,"1755 Ryan Road, Irvine, California, United States, 92717"
37,rpatillo29407,2023-12-15T05:02:25+00:00,812.87,"1159 Bladewood Court, Glendale, Arizona, United States, 85311"
38,estook35965,2024-05-16T09:08:20+00:00,430.32,"494 Jeremy Circle, Sioux Falls, South Dakota, United States, 57105"
39,lheadington53377,2024-06-18T19:40:59+00:00,385.34,"11743 Marrot Terrace, Charlotte, North Carolina, United States, 28225"
40,mhuison19259,2024-03-08T07:41:03+00:00,165.44,"8398 Sanford Street, Washington, District of Columbia, United States, 20520"
41,hczapla40156,2023-11-30T13:43:51+00:00,651.75,"3342 Iberia Court, Fort Smith, Arkansas, United States, 72905"
42,nschoolfield23610,2024-09-05T20:33:28+00:00,221.02,"377 Brier Creek Circle, Detroit, Michigan, United States, 48217"
43,hharcus5639,2024-07-31T04:14:18+00:00,262.54,"7347 Mendoza Blvd., Philadelphia, Pennsylvania, United States, 19191"
44,fambrosini35771,2024-03-14T02:08:27+00:00,223.03,"11360 Loadstar Avenue, Des Moines, Iowa, United States, 50335"
45,rpatillo29407,2024-01-12T05:21:01+00:00,205.65,"5326 Sylewood Avenue, Bismarck, North Dakota, United States, 58505"
46,bduke43184,2023-10-06T02:20:15+00:00,949.52,"8718 Evans Prairie Trail, Marietta, Georgia, United States, 30061"
47,sblakeston41617,2023-11-18T19:17:19+00:00,906.27,"5121 Woodley Terrace, Fort Wayne, Indiana, United States, 46862"
48,xcauston31600,2024-01-26T23:52:12+00:00,629.75,"9404 Hawkins Drive, New York City, New York, United States, 10160"
49,tibanez52724,2024-07-04T20:31:25+00:00,516.12,"5981 Cynthia Street, Los Angeles, California, United States, 90030"
50,esporrij37298,2024-09-21T13:50:27+00:00,233.75,"9905 Torri Terrace, Phoenix, Arizona, United States, 85083"
51,uparsisson38859,2024-03-11T01:50:27+00:00,783.97,"1253 Lowry Road, Henderson, Nevada, United States, 89074"
52,jkyne58946,2024-06-22T21:02:52+00:00,425.54,"4058 Radford Place, Arlington, Virginia, United States, 22234"
53,uparsisson38859,2023-10-06T22:20:14+00:00,435.59,"647 Pacolet Terrace, Salt Lake City, Utah, United States, 84135"
54,uparsisson38859,2023-11-09T19:40:44+00:00,279.02,"9159 Pisano Way, Albany, New York, United States, 12262"
55,kedland28147,2024-05-01T21:54:20+00:00,550.74,"13923 Kierstin Court, Los Angeles, California, United States, 90076"
56,ggelsthorpe17051,2024-04-02T09:49:54+00:00,978.16,"13792 Rogers Road, Saint Petersburg, Florida, United States, 33710"
57,shaydney26152,2024-06-15T21:13:38+00:00,581.39,"9427 San Diego Street, Little Rock, Arkansas, United States, 72209"
58,wgarment50458,2024-04-04T00:48:27+00:00,772.35,"1325 Okahumpka Run, Virginia Beach, Virginia, United States, 23464"
59,ale blond42950,2024-04-23T17:29:12+00:00,405.06,"10045 Zipperer Way, Washington, District of Columbia, United States, 20036"
60,ldent53909,2024-08-14T16:01:26+00:00,309.46,"4480 San Remo Lane, Washington, District of Columbia, United States, 20220"
61,ldent53909,2024-04-11T11:24:23+00:00,850.70,"1153 Armstrong Avenue, Inglewood, California, United States, 90310"
62,sarnald40787,2024-03-22T04:58:29+00:00,751.49,"411 Faith Terrace, Abilene, Texas, United States, 79699"
63,nbartalini21250,2024-09-13T05:22:53+00:00,598.94,"14373 Vapor Court, Indianapolis, Indiana, United States, 46202"
64,cmatijasevic10905,2024-05-12T13:18:26+00:00,299.62,"3014 Jeter Court, Memphis, Tennessee, United States, 38109"
65,nbartalini21250,2024-06-25T18:29:30+00:00,910.71,"3128 Fox Place, Utica, New York, United States, 13505"
66,ghylden29485,2024-06-14T20:06:51+00:00,886.63,"1116 Mccabe Street, Portland, Oregon, United States, 97232"
67,ealekseev25254,2023-10-30T23:24:56+00:00,905.79,"12088 Melvin Drive, Austin, Texas, United States, 78764"
68,lmcgraith33116,2024-03-22T07:20:29+00:00,684.43,"6017 Hawkins Drive, Fort Worth, Texas, United States, 76105"
69,ggelsthorpe17051,2024-04-16T13:20:22+00:00,848.03,"11901 Ventura Drive, Miami, Florida, United States, 33169"
70,nbreydin9693,2024-07-17T03:18:28+00:00,275.47,"3594 Gibson Avenue, Phoenix, Arizona, United States, 85015"
71,mgolding17577,2024-03-02T02:37:42+00:00,627.26,"10152 Longview Lane, Fort Myers, Florida, United States, 33906"
72,sritmeyer27352,2024-01-13T07:17:22+00:00,237.82,"11014 York Terrace, Phoenix, Arizona, United States, 85062"
73,estook35965,2024-01-08T01:49:48+00:00,642.01,"12293 Melbourne Lane, Flushing, New York, United States, 11388"
74,mrobinson46891,2024-05-22T16:07:49+00:00,340.87,"3850 Junction Place, Pittsburgh, Pennsylvania, United States, 15261"
75,ggarbutt59395,2024-01-22T10:56:43+00:00,189.40,"12889 Zenith Loop, Houston, Texas, United States, 77223"
76,sblakeston41617,2024-05-18T02:51:27+00:00,622.94,"4080 Herrera Court, Washington, District of Columbia, United States, 20099"
77,ale blond42950,2024-03-01T04:01:03+00:00,517.73,"549 Buck Street, Seattle, Washington, United States, 98148"
78,estook35965,2024-03-04T14:06:36+00:00,369.94,"3735 Messina Path, Pinellas Park, Florida, United States, 34665"
79,ebrennand58868,2023-11-05T11:51:59+00:00,363.09,"611 Hibernia Lane, Des Moines, Iowa, United States, 50369"
80,cgalvan46903,2024-03-02T17:51:29+00:00,475.93,"9644 Zipperer Way, Raleigh, North Carolina, United States, 27626"
81,mmacauley50148,2024-05-03T20:30:13+00:00,427.98,"11457 Powhite Place, Greensboro, North Carolina, United States, 27499"
82,mastles46857,2024-04-09T16:08:29+00:00,171.53,"13197 Mead Place, Bronx, New York, United States, 10469"
83,sgehrels51850,2024-02-06T15:35:21+00:00,468.34,"3092 White Ibis Run, Salt Lake City, Utah, United States, 84115"
84,vjenkyn16984,2023-12-09T05:47:42+00:00,451.00,"14501 Zellwood Street, Milwaukee, Wisconsin, United States, 53215"
85,ggelsthorpe17051,2024-03-16T22:53:41+00:00,185.69,"4407 Condrey Court, Louisville, Kentucky, United States, 40210"
86,xcauston31600,2023-12-02T18:12:25+00:00,350.99,"5351 Rutherford Lane, Lansing, Michigan, United States, 48912"
87,rvassbender57545,2023-10-16T02:48:17+00:00,864.55,"2729 Chesterfield Lane, Topeka, Kansas, United States, 66642"
88,hathelstan22743,2024-05-16T22:12:00+00:00,729.44,"8631 Bissell Trail, Chicago, Illinois, United States, 60604"
89,afoord48078,2023-10-07T05:06:14+00:00,717.01,"8587 Alistar Court, Topeka, Kansas, United States, 66606"
90,tcallaby29115,2024-05-16T04:13:51+00:00,831.74,"9541 Donelin Circle, Irvine, California, United States, 92612"
91,wivain47239,2023-12-27T18:02:24+00:00,425.63,"760 Leggett Lane, Little Rock, Arkansas, United States, 72222"
92,cgalvan46903,2024-03-12T16:35:23+00:00,383.72,"9460 Edenton Terrace, Boston, Massachusetts, United States, 02208"
93,fmanjin31370,2024-09-08T05:46:21+00:00,415.50,"13764 Carver Court, Miami, Florida, United States, 33190"
94,iwent63202,2023-12-09T12:51:28+00:00,780.34,"14786 Valente Court, Chicago, Illinois, United States, 60646"
95,atrevaskus17441,2024-07-10T05:54:56+00:00,169.11,"6487 Whited Lane, Fort Pierce, Florida, United States, 34981"
96,mgolding17577,2024-03-20T09:51:06+00:00,446.60,"7505 Gillespie Lane, Bakersfield, California, United States, 93386"
97,ale blond42950,2024-04-12T06:51:33+00:00,316.27,"6300 Tia Terrace, Punta Gorda, Florida, United States, 33982"
98,tibanez52724,2024-05-07T13:32:02+00:00,762.90,"5527 Cochran Street, Orlando, Florida, United States, 32803"
99,bamort50849,2024-08-09T01:29:58+00:00,169.09,"6265 Kyrle Terrace, Saint Louis, Missouri, United States, 63143"
100,lfoye12797,2023-10-19T02:14:17+00:00,782.69,"1132 Gerardo Avenue, Columbia, Missouri, United States, 65218"
